{
  "$schema": "./schemas/data_model.schema.json",
  "$depends_on": ["requirements.json", "architecture.json"],
  "engagement_id": "eng-2026-003",
  "version": "2.0",
  "last_updated": "2026-03-18",
  "status": "complete",

  "data_requirements": {
    "summary": "File-based data model for an AI-native Python pipeline invoked via Claude Code custom skills. No relational database — all persistence is S3 objects and local JSON files. Data flows linearly: SKU Brief JSON in, brand assets checked in S3, images generated via Bedrock, text overlaid via Pillow, final packaging uploaded to S3 organized by SKU/Region/format. Pipeline run manifest (E-006) and skill invocation log (E-007) enable operational visibility without a database.",
    "sources": [
      {
        "name": "SKU Brief",
        "format": "JSON file (local filesystem)",
        "volume": "1-10 KB per brief, 2-4 products per brief",
        "pii_present": false
      },
      {
        "name": "Brand Assets",
        "format": "PNG/JPG images in S3 input bucket",
        "volume": "1-50 MB per asset set",
        "pii_present": false
      },
      {
        "name": "GenAI Image Output",
        "format": "Base64-encoded PNG from Bedrock, decoded to bytes",
        "volume": "6-24 images per pipeline run (3 aspect ratios x 2-4 products; Nova Canvas primary, Titan V2 fallback)",
        "pii_present": false
      },
      {
        "name": "Pipeline Run Manifest",
        "format": "JSON file (local + S3)",
        "volume": "1-5 KB per run",
        "pii_present": false
      },
      {
        "name": "Skill Invocation Log",
        "format": "JSON file (local)",
        "volume": "< 1 KB per invocation",
        "pii_present": false
      }
    ],
    "storage_pattern": "S3 object storage with key-based hierarchy. No database. Pipeline state is ephemeral (in-memory during run). Pipeline run manifest (E-006) written to S3 and local filesystem for operational visibility via /pipeline-status skill.",
    "data_residency": "us-east-1",
    "retention_days": 90,
    "encryption": "SSE-S3 at rest, TLS in transit"
  },

  "entities": [
    {
      "id": "E-001",
      "name": "SKU Brief",
      "description": "JSON input document defining products, target region, audience, and attributes for packaging generation. Primary pipeline input — provided via /run-pipeline skill as a local file path. All string fields sanitized before prompt interpolation (prompt injection mitigation).",
      "storage": "Local filesystem (JSON file path passed to /run-pipeline skill)",
      "fields": [
        { "name": "brief_id", "type": "string", "nullable": false, "primary_key": true, "indexed": false },
        { "name": "brand", "type": "string", "nullable": false, "primary_key": false, "indexed": false },
        { "name": "region", "type": "string", "nullable": false, "primary_key": false, "indexed": false, "values": ["us", "eu", "asia-pacific"] },
        { "name": "target_audience", "type": "string", "nullable": true, "primary_key": false, "indexed": false },
        { "name": "products", "type": "array<Product>", "nullable": false, "primary_key": false, "indexed": false },
        { "name": "products[].sku_id", "type": "string", "nullable": false, "primary_key": false, "indexed": false },
        { "name": "products[].name", "type": "string", "nullable": false, "primary_key": false, "indexed": false },
        { "name": "products[].flavor", "type": "string", "nullable": true, "primary_key": false, "indexed": false },
        { "name": "products[].attributes", "type": "array<string>", "nullable": true, "primary_key": false, "indexed": false, "values": ["organic", "vegan", "gluten-free", "seasonal", "limited-edition"] },
        { "name": "products[].regulatory_text", "type": "string", "nullable": true, "primary_key": false, "indexed": false },
        { "name": "products[].allergens", "type": "array<string>", "nullable": true, "primary_key": false, "indexed": false }
      ],
      "validation": "jsonschema validation at C-002. Max field lengths enforced per schema. Fail-fast before any S3 or Bedrock calls.",
      "relationships": [
        { "target": "E-002", "type": "one_to_many", "foreign_key": "brand" },
        { "target": "E-003", "type": "one_to_many", "foreign_key": "products[].sku_id" },
        { "target": "E-006", "type": "one_to_one", "foreign_key": "brief_id" }
      ]
    },
    {
      "id": "E-002",
      "name": "Brand Asset",
      "description": "Pre-existing brand assets (logos, product photos, templates) stored in the S3 input bucket. The Asset Manager (C-003) checks for these before triggering GenAI generation. S3 key convention: {brand}/{asset_type}/{filename}.",
      "storage": "Amazon S3 (input_assets bucket, us-east-1, Block Public Access enabled)",
      "fields": [
        { "name": "s3_key", "type": "string", "nullable": false, "primary_key": true, "indexed": false },
        { "name": "brand", "type": "string", "nullable": false, "primary_key": false, "indexed": false },
        { "name": "asset_type", "type": "string", "nullable": false, "primary_key": false, "indexed": false, "values": ["logo", "product_photo", "template", "icon"] },
        { "name": "filename", "type": "string", "nullable": false, "primary_key": false, "indexed": false },
        { "name": "content_type", "type": "string", "nullable": false, "primary_key": false, "indexed": false, "values": ["image/png", "image/jpeg"] },
        { "name": "size_bytes", "type": "integer", "nullable": false, "primary_key": false, "indexed": false },
        { "name": "last_modified", "type": "datetime", "nullable": false, "primary_key": false, "indexed": false },
        { "name": "etag", "type": "string", "nullable": false, "primary_key": false, "indexed": false }
      ],
      "relationships": [
        { "target": "E-001", "type": "many_to_one", "foreign_key": "brand" }
      ]
    },
    {
      "id": "E-003",
      "name": "Generated Image",
      "description": "Raw image output from Amazon Bedrock (Nova Canvas primary, Titan V2 fallback). One image per product-aspect-ratio combination. Ephemeral in-memory PIL bytes object during processing — never persisted as intermediate file. In dry-run mode: 1x1 pixel placeholder bytes (zero API cost). Cache: stored at ~/.cache/pai-pipeline/{sha256_hash}.png by content hash if caching enabled.",
      "storage": "In-memory (bytes object, ephemeral during pipeline run). Optional local cache: ~/.cache/pai-pipeline/{sha256_hash}.png",
      "dry_run_note": "dry_run=True returns 1x1 pixel placeholder PNG bytes — no Bedrock API call. No S3 upload in dry-run mode (manifest only).",
      "cache_note": "Cache key: SHA-256(prompt + width + height + model_id). Cache hit skips Bedrock call entirely. Cache persists across runs for cost-efficient debug iterations.",
      "fields": [
        { "name": "generation_id", "type": "string", "nullable": false, "primary_key": true, "indexed": false },
        { "name": "sku_id", "type": "string", "nullable": false, "primary_key": false, "indexed": false },
        { "name": "aspect_ratio", "type": "string", "nullable": false, "primary_key": false, "indexed": false, "values": ["1:1", "9:16", "16:9"] },
        { "name": "width_px", "type": "integer", "nullable": false, "primary_key": false, "indexed": false },
        { "name": "height_px", "type": "integer", "nullable": false, "primary_key": false, "indexed": false },
        { "name": "model_id", "type": "string", "nullable": false, "primary_key": false, "indexed": false, "values": ["amazon.nova-canvas-v1:0", "amazon.titan-image-generator-v2:0"] },
        { "name": "model_tier", "type": "string", "nullable": false, "primary_key": false, "indexed": false, "values": ["dev", "iterate", "final"] },
        { "name": "prompt_text", "type": "string", "nullable": false, "primary_key": false, "indexed": false },
        { "name": "dry_run", "type": "boolean", "nullable": false, "primary_key": false, "indexed": false },
        { "name": "cache_hit", "type": "boolean", "nullable": false, "primary_key": false, "indexed": false },
        { "name": "generation_timestamp", "type": "datetime", "nullable": false, "primary_key": false, "indexed": false },
        { "name": "latency_ms", "type": "integer", "nullable": true, "primary_key": false, "indexed": false },
        { "name": "estimated_cost_usd", "type": "float", "nullable": false, "primary_key": false, "indexed": false }
      ],
      "relationships": [
        { "target": "E-001", "type": "many_to_one", "foreign_key": "sku_id" },
        { "target": "E-004", "type": "one_to_one", "foreign_key": "generation_id" }
      ]
    },
    {
      "id": "E-004",
      "name": "Packaging Output",
      "description": "Final composited packaging image with Pillow text overlay (product name, attributes, regulatory info), uploaded to the S3 output bucket. S3 key convention: {sku_id}/{region}/{format}/{filename}. Not created in dry-run mode.",
      "storage": "Amazon S3 (output_packaging bucket, us-east-1, Block Public Access enabled)",
      "fields": [
        { "name": "s3_key", "type": "string", "nullable": false, "primary_key": true, "indexed": false },
        { "name": "sku_id", "type": "string", "nullable": false, "primary_key": false, "indexed": false },
        { "name": "region", "type": "string", "nullable": false, "primary_key": false, "indexed": false },
        { "name": "aspect_ratio", "type": "string", "nullable": false, "primary_key": false, "indexed": false, "values": ["1:1", "9:16", "16:9"] },
        { "name": "packaging_type", "type": "string", "nullable": false, "primary_key": false, "indexed": false, "values": ["front_label", "back_label", "wraparound"] },
        { "name": "content_type", "type": "string", "nullable": false, "primary_key": false, "indexed": false, "values": ["image/png"] },
        { "name": "width_px", "type": "integer", "nullable": false, "primary_key": false, "indexed": false },